{
  "spotId": "hinoki-village",
  "status": "references-collected",
  "spotType": "urban",
  "productionTier": "standard",
  "hero": {
    "name": "Hinoki Village dormitories",
    "silhouette": "Rows of Japanese-style wooden houses with dark tiled roofs among gardens"
  },
  "crop": "A cluster of the restored wooden dormitories and their lanes. Not the whole Chiayi forestry area.",
  "heroScale": 1,
  "orientation": "Selected timber-house cluster is west of the school stadium, organized around garden lanes; verify: individual dormitory footprint alignment.",
  "lockedGeometry": [
    "rows of single-storey houses",
    "gravel lanes and gardens",
    "tall trees between houses"
  ],
  "lockedIdentity": [
    "hinoki wood walls",
    "dark Japanese tile roofs",
    "sliding wooden doors"
  ],
  "doNotInvent": [
    "temples",
    "skyscrapers",
    "torii gates"
  ],
  "allowedMiniatureDetails": [
    "visitors in the lanes",
    "potted plants",
    "bicycles"
  ],
  "references": {
    "aerial": [
      "google-satellite-review.jpg"
    ],
    "ground": [
      "real-photo.jpg",
      "google-ground-review.jpg"
    ],
    "map": [
      "google-satellite-review.jpg"
    ],
    "representative": [
      "real-photo.jpg"
    ]
  },
  "worldToken": {
    "element": "One wooden Japanese house with a tree"
  },
  "qa": {
    "geographic": "pending",
    "identity": "pending",
    "style": "pass",
    "collection": "pass",
    "notes": "2026-10-15 review-v1.png, new collection preview only. Real timber-house ground panorama and satellite garden cluster compared. Houses are a representative compact crop; exact dormitory identities and footprints remain pending. User approval pending; formal runtime assets and tokens unchanged. Source acquisition dates are recorded where visible; satellite acquisition dates unavailable. Presentation self-check: coherent square ivory plinth, no boards/hardware, complete visible footprint and miniature material finish; main subject remains legible at 512px. Geographic identity and user acceptance still pending."
  }
}
