{
  "spotId": "maokong",
  "status": "references-collected",
  "spotType": "urban",
  "productionTier": "standard",
  "hero": {
    "name": "Maokong gondola station",
    "silhouette": "Enclosed gondola cabins on cables above wooded slopes at the upper Maokong station"
  },
  "crop": "Upper Maokong station and its forested cable approach; omit unverified adjacent tea terraces and distant city.",
  "heroScale": 1,
  "orientation": "Cable approach extends northwest away from upper Maokong Station through wooded slopes (satellite); verify: exact station facade and cabin positions.",
  "lockedGeometry": [
    "modest hillside upper station beside a road bend",
    "cable approach descending northwest",
    "densely wooded slopes around the selected cable corridor"
  ],
  "lockedIdentity": [
    "enclosed rounded rectangular gondola cabins suspended from cables",
    "forested mountain cable corridor at upper Maokong station"
  ],
  "doNotInvent": [
    "ski lifts",
    "snow",
    "skyscrapers next to the station"
  ],
  "allowedMiniatureDetails": [
    "visitors drinking tea",
    "teahouse terraces",
    "mist"
  ],
  "references": {
    "aerial": [
      "google-satellite-review.jpg"
    ],
    "ground": [
      "real-photo.jpg",
      "google-ground-review.jpg"
    ],
    "map": [
      "google-satellite-review.jpg"
    ],
    "representative": [
      "real-photo.jpg"
    ]
  },
  "worldToken": {
    "element": "A gondola cabin above tea rows"
  },
  "qa": {
    "geographic": "pending",
    "identity": "pending",
    "style": "pending",
    "collection": "pending",
    "notes": "2026-10-15 review-v1.png, new collection preview only. Actual enclosed cabins and cable corridor photo plus upper-station satellite used. Default 360 showed unrelated tea patio and is rejected. Station exterior/360 remains pending; no unverified adjacent tea terrace added. User approval pending; formal runtime assets and tokens unchanged. Source acquisition dates are recorded where visible; satellite acquisition dates unavailable. Presentation self-check: coherent square ivory plinth, no boards/hardware, complete visible footprint and miniature material finish; main subject remains legible at 512px. Geographic identity and user acceptance still pending. | 2026-10-15 review-v2.png: Imported user review repair: 纜車的話, 那個連接線好像憑空長出來, 要有模型的感覺 Self-check: Loose cable ends replaced by supported in-base display return wheel and station machinery. Return fixture is a model presentation device, not a claim that this tourist installation exists there; upper station facade remains unverified. User acceptance pending. Preview only; user acceptance and unresolved geographic QA remain pending. No runtime promotion or new full map audit."
  }
}
