{
  "spotId": "kenting",
  "status": "references-collected",
  "spotType": "natural",
  "productionTier": "standard",
  "hero": {
    "name": "Kenting Baisha Bay",
    "silhouette": "Curved pale coral-sand beach between rocky green headlands and clear turquoise sea"
  },
  "crop": "A representative slice of Baisha Bay: curved beach, turquoise shallows and low vegetated headland, matching the collected real photo.",
  "heroScale": 1,
  "orientation": "Elevated three-quarter view from the shore toward the bay, based on the real photograph.",
  "lockedGeometry": [
    "curved sandy shore",
    "ocean in front of the beach",
    "low vegetation and rocky headland behind the shore"
  ],
  "lockedIdentity": [
    "pale coral-sand beach",
    "clear turquoise shallows and gentle surf",
    "low green coastal headland"
  ],
  "doNotInvent": [
    "Taiwan flags",
    "random buildings",
    "high-rise resort towers",
    "piers and marinas",
    "volcanoes",
    "Eluanbi Lighthouse (outside the crop)",
    "theme-park structures"
  ],
  "allowedMiniatureDetails": [
    "beachgoers and parasols",
    "scooters on the coastal road"
  ],
  "references": {
    "aerial": [
      "google-aerial-review.jpg"
    ],
    "ground": [
      "google-ground-review.jpg"
    ],
    "map": [],
    "representative": [
      "real-photo.jpg"
    ]
  },
  "worldToken": {
    "element": "Compact curved pale sand beach with turquoise shallows and rocky green headland",
    "notes": "Match the Baisha Bay reference: pale curved beach, turquoise shallows and low green headland."
  },
  "qa": {
    "geographic": "pending",
    "identity": "pending",
    "style": "pending",
    "collection": "pending",
    "notes": "Baisha Bay reference used instead of app Kenting-town marker. Sandy coast distinct from pebble beach; vegetation, umbrella arrangement and far headland contours remain simplified. New real-reference generation in review-v1.png; visual review only, not auto-approved. Same apparatus reference Tamsui review-v3. | 2026-10-15 review-v2.png: removed all backdrop cards and hardware; square ivory plinth / camera and architectural alignment reviewed. This is a presentation edit, not a new map audit or automatic approval. Real geographic details and user acceptance remain pending."
  }
}
