{
  "spotId": "brown-avenue",
  "status": "references-collected",
  "spotType": "natural",
  "productionTier": "standard",
  "hero": {
    "name": "Mr. Brown Avenue and the Kaneshiro tree",
    "silhouette": "Perfectly straight narrow road running through flat paddy fields, with a lone broad tree beside it and mountain ranges on both horizons"
  },
  "crop": "One stretch of the avenue through the paddies including the lone tree, with the mountains in the distance. Not the whole Chishang plain.",
  "heroScale": 1,
  "orientation": "Rice plain of the East Rift Valley; Central Mountain Range to the west, Coastal Mountain Range to the east (verify: avenue direction)",
  "lockedGeometry": [
    "straight road alignment",
    "flat paddy field grid on both sides",
    "lone tree position beside the road",
    "mountain ranges on both sides of the valley"
  ],
  "lockedIdentity": [
    "unbroken skyline with no utility poles",
    "green or golden rice paddies depending on season",
    "lone tree silhouette (verify: species and shape)"
  ],
  "doNotInvent": [
    "motor vehicles on the pedestrian and cycling avenue",
    "Taiwan flags",
    "random buildings",
    "utility poles and power lines",
    "windmills",
    "farmhouses along the avenue",
    "rows of trees lining the road",
    "billboards"
  ],
  "allowedMiniatureDetails": [
    "miniature cyclists on the road",
    "a farm tractor in a paddy",
    "egrets in the fields"
  ],
  "references": {
    "aerial": [
      "google-aerial-review.jpg"
    ],
    "ground": [
      "google-ground-review.jpg"
    ],
    "map": [],
    "representative": [
      "real-photo.jpg"
    ]
  },
  "worldToken": {
    "element": "Lone tree beside a short straight road on a paddy patch",
    "notes": "Tree and road only — the emptiness is the identity."
  },
  "qa": {
    "geographic": "pending",
    "identity": "pending",
    "style": "pending",
    "collection": "pending",
    "notes": "Tree/lane junction and rectangular paddies referenced; seasons differ across source photos, rendered green-rice scene. Tree age/crown, channels and small decorative tractor/birds not exact survey. New real-reference generation in review-v1.png; visual review only, not auto-approved. Same apparatus reference Tamsui review-v3. | 2026-10-15 review-v2.png: removed all backdrop cards and hardware; square ivory plinth / camera and architectural alignment reviewed. This is a presentation edit, not a new map audit or automatic approval. Real geographic details and user acceptance remain pending. | 2026-10-15 review-v3.png: Imported user review repair: 底座非方形, 有點不規則, 跟其他圖不一樣 Self-check: Square straight-edged support and continuous rim revised; rice plots, avenue and single large tree retained; farm vehicle stays in field, not pedestrian avenue. Preview only; user acceptance and unresolved geographic QA remain pending. No runtime promotion or new full map audit."
  }
}
